{"schemaVersion":1,"contract":"quant-research-summary","projectId":"etf","projectName":"ETF TOP10 Tracking","generatedAt":"2026-10-16T05:02:46+00:00","dataAsOf":"2026-10-16","timezone":"Asia/Seoul","detailUrl":"https://sonchanggi.github.io/etf-tracking/","detailDataUrl":"https://sonchanggi.github.io/etf-tracking/data/dashboard.json","status":{"state":"ok","label":"3개 ETF · 12개 최근 신호","cadence":"scheduled 09:47/13:17/16:47 KST Mon-Fri plus reviewed workflow_dispatch","expectedFreshnessDays":3,"degradedReasons":[]},"coverage":{"etfCount":3,"signalCount":12,"historyStorage":"per_etf_lazy_files","historyManifestUrl":"data/history.json"},"highlights":[{"label":"ETF","value":3,"description":"한국 상장 액티브 ETF 추적"},{"label":"신호","value":12,"description":"편입·편출 및 residual possibility"},{"label":"최근 기준일","value":"2026-10-16","description":"ETF별 latest date 기준"}],"primaryEntities":[{"entityKey":"time-nasdaq100-active:NVDA","symbol":"NVDA","name":"NVIDIA Corp","label":"NVDA · TIME 나스닥100","sector":"ETF Holdings","sectorLabel":"ETF 보유종목","themes":["ETF","Active ETF","TIME 나스닥100"],"metrics":{"weight":0.0821,"rank":1,"date":"2026-10-16","etf":"TIME 나스닥100","returnCoverage":0.9729081275617314},"signals":["TOP10 보유 노출입니다. residual signal은 실제 매매 증명이 아니라 가능성 신호입니다."],"warnings":["가격 정렬은 no-trade 증명이 아니며, 공급자 공시 지연이 있을 수 있습니다."]},{"entityKey":"time-nasdaq100-active:MSFT","symbol":"MSFT","name":"Microsoft Corp","label":"MSFT · TIME 나스닥100","sector":"ETF Holdings","sectorLabel":"ETF 보유종목","themes":["ETF","Active ETF","TIME 나스닥100"],"metrics":{"weight":0.057699999999999994,"rank":2,"date":"2026-10-16","etf":"TIME 나스닥100","returnCoverage":0.9729081275617314},"signals":["TOP10 보유 노출입니다. residual signal은 실제 매매 증명이 아니라 가능성 신호입니다."],"warnings":["가격 정렬은 no-trade 증명이 아니며, 공급자 공시 지연이 있을 수 있습니다."]},{"entityKey":"time-nasdaq100-active:AAPL","symbol":"AAPL","name":"Apple Inc","label":"AAPL · TIME 나스닥100","sector":"ETF Holdings","sectorLabel":"ETF 보유종목","themes":["ETF","Active ETF","TIME 나스닥100"],"metrics":{"weight":0.0493,"rank":3,"date":"2026-10-16","etf":"TIME 나스닥100","returnCoverage":0.9729081275617314},"signals":["TOP10 보유 노출입니다. residual signal은 실제 매매 증명이 아니라 가능성 신호입니다."],"warnings":["가격 정렬은 no-trade 증명이 아니며, 공급자 공시 지연이 있을 수 있습니다."]},{"entityKey":"time-nasdaq100-active:GOOGL","symbol":"GOOGL","name":"Alphabet Inc","label":"GOOGL · TIME 나스닥100","sector":"ETF Holdings","sectorLabel":"ETF 보유종목","themes":["ETF","Active ETF","TIME 나스닥100"],"metrics":{"weight":0.0478,"rank":4,"date":"2026-10-16","etf":"TIME 나스닥100","returnCoverage":0.9729081275617314},"signals":["TOP10 보유 노출입니다. residual signal은 실제 매매 증명이 아니라 가능성 신호입니다."],"warnings":["가격 정렬은 no-trade 증명이 아니며, 공급자 공시 지연이 있을 수 있습니다."]},{"entityKey":"time-nasdaq100-active:MU","symbol":"MU","name":"Micron Technology Inc","label":"MU · TIME 나스닥100","sector":"ETF Holdings","sectorLabel":"ETF 보유종목","themes":["ETF","Active ETF","TIME 나스닥100"],"metrics":{"weight":0.040999999999999995,"rank":5,"date":"2026-10-16","etf":"TIME 나스닥100","returnCoverage":0.9729081275617314},"signals":["TOP10 보유 노출입니다. residual signal은 실제 매매 증명이 아니라 가능성 신호입니다."],"warnings":["가격 정렬은 no-trade 증명이 아니며, 공급자 공시 지연이 있을 수 있습니다."]},{"entityKey":"time-nasdaq100-active:DELL","symbol":"DELL","name":"Dell Technologies Inc","label":"DELL · TIME 나스닥100","sector":"ETF Holdings","sectorLabel":"ETF 보유종목","themes":["ETF","Active ETF","TIME 나스닥100"],"metrics":{"weight":0.0393,"rank":6,"date":"2026-10-16","etf":"TIME 나스닥100","returnCoverage":0.9729081275617314},"signals":["TOP10 보유 노출입니다. residual signal은 실제 매매 증명이 아니라 가능성 신호입니다."],"warnings":["가격 정렬은 no-trade 증명이 아니며, 공급자 공시 지연이 있을 수 있습니다."]},{"entityKey":"time-nasdaq100-active:NQZ6 INDEX","symbol":"NQZ6 INDEX","name":"NASDAQ 100 E-MINI INDEX DEC 2026","label":"NQZ6 INDEX · TIME 나스닥100","sector":"ETF Holdings","sectorLabel":"ETF 보유종목","themes":["ETF","Active ETF","TIME 나스닥100"],"metrics":{"weight":0.0373,"rank":7,"date":"2026-10-16","etf":"TIME 나스닥100","returnCoverage":0.9729081275617314},"signals":["TOP10 보유 노출입니다. residual signal은 실제 매매 증명이 아니라 가능성 신호입니다."],"warnings":["가격 정렬은 no-trade 증명이 아니며, 공급자 공시 지연이 있을 수 있습니다."]},{"entityKey":"time-nasdaq100-active:AMD","symbol":"AMD","name":"Advanced Micro Devices Inc","label":"AMD · TIME 나스닥100","sector":"ETF Holdings","sectorLabel":"ETF 보유종목","themes":["ETF","Active ETF","TIME 나스닥100"],"metrics":{"weight":0.0362,"rank":8,"date":"2026-10-16","etf":"TIME 나스닥100","returnCoverage":0.9729081275617314},"signals":["TOP10 보유 노출입니다. residual signal은 실제 매매 증명이 아니라 가능성 신호입니다."],"warnings":["가격 정렬은 no-trade 증명이 아니며, 공급자 공시 지연이 있을 수 있습니다."]},{"entityKey":"time-nasdaq100-active:INTC","symbol":"INTC","name":"Intel Corp","label":"INTC · TIME 나스닥100","sector":"ETF Holdings","sectorLabel":"ETF 보유종목","themes":["ETF","Active ETF","TIME 나스닥100"],"metrics":{"weight":0.0361,"rank":9,"date":"2026-10-16","etf":"TIME 나스닥100","returnCoverage":0.9729081275617314},"signals":["TOP10 보유 노출입니다. residual signal은 실제 매매 증명이 아니라 가능성 신호입니다."],"warnings":["가격 정렬은 no-trade 증명이 아니며, 공급자 공시 지연이 있을 수 있습니다."]},{"entityKey":"time-nasdaq100-active:AMZN","symbol":"AMZN","name":"Amazon.com Inc","label":"AMZN · TIME 나스닥100","sector":"ETF Holdings","sectorLabel":"ETF 보유종목","themes":["ETF","Active ETF","TIME 나스닥100"],"metrics":{"weight":0.035699999999999996,"rank":10,"date":"2026-10-16","etf":"TIME 나스닥100","returnCoverage":0.9729081275617314},"signals":["TOP10 보유 노출입니다. residual signal은 실제 매매 증명이 아니라 가능성 신호입니다."],"warnings":["가격 정렬은 no-trade 증명이 아니며, 공급자 공시 지연이 있을 수 있습니다."]},{"entityKey":"time-global-ai-active:INTC","symbol":"INTC","name":"Intel Corp","label":"INTC · TIME 글로벌AI","sector":"ETF Holdings","sectorLabel":"ETF 보유종목","themes":["ETF","Active ETF","TIME 글로벌AI"],"metrics":{"weight":0.057,"rank":1,"date":"2026-10-16","etf":"TIME 글로벌AI","returnCoverage":0.9554178328668532},"signals":["TOP10 보유 노출입니다. residual signal은 실제 매매 증명이 아니라 가능성 신호입니다."],"warnings":["가격 정렬은 no-trade 증명이 아니며, 공급자 공시 지연이 있을 수 있습니다."]},{"entityKey":"time-global-ai-active:NVDA","symbol":"NVDA","name":"NVIDIA Corp","label":"NVDA · TIME 글로벌AI","sector":"ETF Holdings","sectorLabel":"ETF 보유종목","themes":["ETF","Active ETF","TIME 글로벌AI"],"metrics":{"weight":0.0492,"rank":2,"date":"2026-10-16","etf":"TIME 글로벌AI","returnCoverage":0.9554178328668532},"signals":["TOP10 보유 노출입니다. residual signal은 실제 매매 증명이 아니라 가능성 신호입니다."],"warnings":["가격 정렬은 no-trade 증명이 아니며, 공급자 공시 지연이 있을 수 있습니다."]},{"entityKey":"time-global-ai-active:NQZ6 INDEX","symbol":"NQZ6 INDEX","name":"NASDAQ 100 E-MINI INDEX DEC 2026","label":"NQZ6 INDEX · TIME 글로벌AI","sector":"ETF Holdings","sectorLabel":"ETF 보유종목","themes":["ETF","Active ETF","TIME 글로벌AI"],"metrics":{"weight":0.0455,"rank":3,"date":"2026-10-16","etf":"TIME 글로벌AI","returnCoverage":0.9554178328668532},"signals":["TOP10 보유 노출입니다. residual signal은 실제 매매 증명이 아니라 가능성 신호입니다."],"warnings":["가격 정렬은 no-trade 증명이 아니며, 공급자 공시 지연이 있을 수 있습니다."]},{"entityKey":"time-global-ai-active:AMD","symbol":"AMD","name":"Advanced Micro Devices Inc","label":"AMD · TIME 글로벌AI","sector":"ETF Holdings","sectorLabel":"ETF 보유종목","themes":["ETF","Active ETF","TIME 글로벌AI"],"metrics":{"weight":0.043,"rank":4,"date":"2026-10-16","etf":"TIME 글로벌AI","returnCoverage":0.9554178328668532},"signals":["TOP10 보유 노출입니다. residual signal은 실제 매매 증명이 아니라 가능성 신호입니다."],"warnings":["가격 정렬은 no-trade 증명이 아니며, 공급자 공시 지연이 있을 수 있습니다."]},{"entityKey":"time-global-ai-active:SNOW","symbol":"SNOW","name":"Snowflake Inc","label":"SNOW · TIME 글로벌AI","sector":"ETF Holdings","sectorLabel":"ETF 보유종목","themes":["ETF","Active ETF","TIME 글로벌AI"],"metrics":{"weight":0.0379,"rank":5,"date":"2026-10-16","etf":"TIME 글로벌AI","returnCoverage":0.9554178328668532},"signals":["TOP10 보유 노출입니다. residual signal은 실제 매매 증명이 아니라 가능성 신호입니다."],"warnings":["가격 정렬은 no-trade 증명이 아니며, 공급자 공시 지연이 있을 수 있습니다."]},{"entityKey":"time-global-ai-active:CRM","symbol":"CRM","name":"Salesforce Inc","label":"CRM · TIME 글로벌AI","sector":"ETF Holdings","sectorLabel":"ETF 보유종목","themes":["ETF","Active ETF","TIME 글로벌AI"],"metrics":{"weight":0.035,"rank":6,"date":"2026-10-16","etf":"TIME 글로벌AI","returnCoverage":0.9554178328668532},"signals":["TOP10 보유 노출입니다. residual signal은 실제 매매 증명이 아니라 가능성 신호입니다."],"warnings":["가격 정렬은 no-trade 증명이 아니며, 공급자 공시 지연이 있을 수 있습니다."]},{"entityKey":"time-global-ai-active:SAP","symbol":"SAP","name":"SAP SE","label":"SAP · TIME 글로벌AI","sector":"ETF Holdings","sectorLabel":"ETF 보유종목","themes":["ETF","Active ETF","TIME 글로벌AI"],"metrics":{"weight":0.0349,"rank":7,"date":"2026-10-16","etf":"TIME 글로벌AI","returnCoverage":0.9554178328668532},"signals":["TOP10 보유 노출입니다. residual signal은 실제 매매 증명이 아니라 가능성 신호입니다."],"warnings":["가격 정렬은 no-trade 증명이 아니며, 공급자 공시 지연이 있을 수 있습니다."]},{"entityKey":"time-global-ai-active:NOW","symbol":"NOW","name":"ServiceNow Inc","label":"NOW · TIME 글로벌AI","sector":"ETF Holdings","sectorLabel":"ETF 보유종목","themes":["ETF","Active ETF","TIME 글로벌AI"],"metrics":{"weight":0.030299999999999997,"rank":8,"date":"2026-10-16","etf":"TIME 글로벌AI","returnCoverage":0.9554178328668532},"signals":["TOP10 보유 노출입니다. residual signal은 실제 매매 증명이 아니라 가능성 신호입니다."],"warnings":["가격 정렬은 no-trade 증명이 아니며, 공급자 공시 지연이 있을 수 있습니다."]},{"entityKey":"time-global-ai-active:ACN","symbol":"ACN","name":"Accenture PLC","label":"ACN · TIME 글로벌AI","sector":"ETF Holdings","sectorLabel":"ETF 보유종목","themes":["ETF","Active ETF","TIME 글로벌AI"],"metrics":{"weight":0.0302,"rank":9,"date":"2026-10-16","etf":"TIME 글로벌AI","returnCoverage":0.9554178328668532},"signals":["TOP10 보유 노출입니다. residual signal은 실제 매매 증명이 아니라 가능성 신호입니다."],"warnings":["가격 정렬은 no-trade 증명이 아니며, 공급자 공시 지연이 있을 수 있습니다."]},{"entityKey":"time-global-ai-active:0043Y0","symbol":"0043Y0","name":"TIME 차이나AI테크액티브","label":"0043Y0 · TIME 글로벌AI","sector":"ETF Holdings","sectorLabel":"ETF 보유종목","themes":["ETF","Active ETF","TIME 글로벌AI"],"metrics":{"weight":0.03,"rank":10,"date":"2026-10-16","etf":"TIME 글로벌AI","returnCoverage":0.9554178328668532},"signals":["TOP10 보유 노출입니다. residual signal은 실제 매매 증명이 아니라 가능성 신호입니다."],"warnings":["가격 정렬은 no-trade 증명이 아니며, 공급자 공시 지연이 있을 수